Book,Books > Fiction > Science Fiction,9780525951575,Preludio a la fundación,"Preludio a la Fundación es el primer libro del ""Ciclo de la Fundación"", tercer bloque de la célebre ""Saga de la Fundación"", la serie que catapultó al autor en lo más alto de la ciencia ficción.",Book partner,9780525951575,11.99,14
Book,Books > Fiction > Science Fiction,9780684833392,Hacia la fundación,"Hacia la Fundación es el segundo libro del ""Ciclo de la Fundación"", tercer bloque de la célebre ""Saga de la Fundación"" de Isaac Asimov, una portentosa saga que constituye una extraordinaria visión del futuro y que abarca miles de años y docenas de mundos.",Book partner,9780684833392,11.99,18
Book,Books > Fiction > Science Fiction,9780765319852,Fundación,"Fundación es el tercer volumen del ""Ciclo de la Fundación"", pero también la primera parte de la original ""Trilogía de la Fundación"" o ""Ciclo de Trántor"", que puede leerse independientemente y que fue galardonada con el Premio Hugo a la mejor serie de ciencia ficción de todos los tiempos.",Book partner,9780765319852,11.99,13
Book,Books > Fiction > Science Fiction,9780765348272,Fundación e Imperio,"Fundación e Imperio es el cuarto volumen del ""Ciclo de la Fundación"", pero también la segunda parte de la original ""Trilogía de la Fundación"" o ""Ciclo de Trántor"", que puede leerse independientemente y que fue galardonada con el Premio Hugo a la mejor serie de ciencia ficción de todos los tiempos.",Book partner,9780765348272,11.99,6
Book,Books > Fiction > Science Fiction,9780345467171,Segunda fundación,"Segunda Fundación es el quinto volumen del ""Ciclo de la Fundación"", pero también es el cierre de la original ""Trilogía de la Fundación"" o ""Ciclo de Trántor"", que puede leerse independientemente y que fue galardonada con el Premio Hugo a la mejor serie de ciencia ficción de todos los tiempos.",Book partner,9780345467171,11.99,10
Book,Books > Fiction > Science Fiction,9780425198681,Límites de la fundación,"Los límites de la Fundación, sexto libro del ""Ciclo de la Fundación"", es la continuación de la ""Trilogía de la Fundación"" o ""Ciclo de Trántor"", la obra maestra de la ciencia ficción de Isaac Asimov.",Book partner,9780425198681,11.99,7
Book,Books > Fiction > Science Fiction,9780441016792,Fundación y Tierra,"Fundación y Tierra cierra argumentalmente el ""Ciclo de la Fundación"", así como la secuela a la grandiosa ""Trilogía de la Fundación"", y constituye una novela soberbia en la que vemos cómo la Humanidad, en un lejano futuro galáctico, busca sus orígenes en un planeta perdido llamado Tierra.",Book partner,9780441016792,11.99,8